product_id,review_body,product_category
1400599997,"I love my Nook. it is charming and I can customize it with different colors,  and use my own pictures as screensavers.   In addition, I can \\""see\\"" the real covers of books and magazines in color at the bottom of the devise.  My friend has a Kindle and she is always complaining,  besides the text- to- speech is not available with all books.    Good thing is that Nook supports epub while Kindle does not.  The Nook has a user replaceable battery, if I need. On top of all reasons, I can read  any book for free if I go to the store, to me it is handy, because I like to go to B&N and spend sometime there reading, drinking a good coffee etc.  However, I believe that the choice of e-readers ( and there are so many out there!) will depend on what features you like as they are all good products.  I have an Iliad as well, but with Nook I can buy books no matter where I am.",Electronics
1400599997,"I got it with no problems, any i came even with books for free :) sdfsdfds sdfdsfds sdfsd sfs sdfsd",Electronics
1400599997,"In my opinion the Nook rates a 5 for reading pleasure!  Clear print, easy turn of pages, no glare in reading outside. Love it for reading.  But my love of it stops there. My disappointments are that I'm now carrying this new toy in my purse, but can't use it for anything other than reading.  Can't get my Verizon email on it, has no date book, has no way of adding notes of things to do (simple text app)....so, in addition to my Nook, I also have to carry my ipod (which has a wonderful 'notes' app and can get Verizon email), and my big ole calendar to access my many appointments.  Very disappointed that Nook doesn't have other 'apps' to add to make life a bit more organized.",Electronics
1400599997,"I spent a long time researching and trying out various eReaders, and 2 months after going with the Nook I am very pleased with my decision. I wanted an eReader for portability and easy access to books, and the Nook delivers in full.     It has a pretty decent battery life (I'd recommend airplane mode unless you're actually downloading), is super simple to load books/documents from a computer, and looks/feels great. I'm currently in law school, and have numerous PDFs from various classes loaded onto it. Reading from an eReader is way easier on the eyes than constantly staring at a computer screen (and it costs the same as a single casebook).     I like the Nook's touchscreen interface; it can be a little slow at times, but I haven't had any major issues with it. One of my biggest factors for buying a Nook over a Kindle/Sony was that Barnes & Noble is a BOOKSELLER. This device is designed with book readers in mind. The fact that I can loan eBooks from the library, read eBooks for free while at Barnes & Noble, and the overall design of the thing (multiple options for turning pages, I like to swipe the touchscreen vs. pushing the buttons) put the Nook far out in front. The fact that Barnes & Noble gives you 2 weeks to try the thing out put it over the edge. I initially bought the Wi-fi only version and it froze after the second day, I exchanged it for the Wi-fi/3G at the store no questions asked.     Overall it's a great product and awesome for those that actually like books, not just having the latest gadget.",Electronics
1400599997,"I had every intention of loving this product, however I returned it immediately!  The setup was way too complicated.  If you have ever experienced the ease of an iPad, this will make you feel like you have gone back in time.  I am going to look into the newer Nook and Kindle and see if they have improved the product.",Electronics
1400699894,I just got this thing and although it looks nice and feels nice it has limited capacities.  Most importantly I cannot insert a microSD card with my own epubs into it and this is why they gave you more memory. They hide the fact you cannot expand it with the card and charge you more to get less capacity.  I've never been more disappointed with an Amazon purchase and cannot understand why the B&N website doesn't point this out and neither does the Amazon website.  I'm returning mine ASAP and will order the &#34;Simple&#34; model with Glowlight--the &#34;simple&#34; one is more capable.  I am very disappointed in their marketing of this model (deliberately deceitful).  The reason I have liked the B&N readers is their expandability and this trumps the Kindle features in my mind.,Electronics
1400699894,"I've had my Nook GlowLight for almost a month now. Before purchasing it, I'd already had ebook readers from other major brands. The reason I bought this was because I saw in the ads that it has the auto-hyphenation function. Absolutely true. It has beautiful font types and can automatically hyphenate the text. I know some people may not care about auto hyphenation but it is very important for me as I prefer reading in larger font size. The ebook readers of other brands may be good in other respects but cannot display text as beautifully as Nook GlowLight does, especially when I use larger font size. The reason I have given it four stars is because the light is not even enough on the top of the page. There has been great improvement from Nook Simple Touch with GlowLight to Nook GlowLight in this respect, but there is still room for improvement. In spite of this and other shortcomings, in terms of reading, this is the best.",Electronics
1400699894,"I  have had several Nooks in the past. THe nook original and the Nook Color. They each had appeal. The original for the E Ink screen. And the Color for the ability to read in the dark. I heard of the Glolight and I was really hesitant to buy another one. Easily one of the best decisions I ever made. It is super light weight. I just love the backlit screen. I thought it would hurt my eyes like staring at a computer screen too long, but the ability to change the brightness eliminates that. It can go from extremely dim and pleasent to so bright you could use it for a dim flashlight.  All in all WONDERFUL device. I am so please with my purchase. The pages turn fast and seamless, and I have never had an issue with it lagging. It has an excellent WIFI connection. All in all, this is my favore tech device.  Thank you Barnes and Noble for creating the perfect reader. For people debaiting between this and a Kindle, defenitely choose Nook. They give you the ability to lend many titles, you can read any book for fre3e whrn inside a B&N store, great customer service, and a free book every friday. Dont get sucked into the KIndle herd. (sorry amazon)",Electronics
1400699894,"I love my Nook w/ Glowlight feature.  It's a real marriage saver.  I've had one for a couple of years, but it got, tragically, stepped on by a student on an overnight bus trip.  I can't sleep without reading, and the room-brightening reading light, since the sad demise of my nook, has brightened our bedroom so much that even I can't drop off well, let alone my husband.  And once I fall asleep, the Nook goes off in only 15 mins after my turning a page, so I don't have a nightlight on.  I charge it about twice monthly.  I'm getting a new one today.",Electronics
1400699894,Very nice and light but it does have a habit of freezing if you keep it on for long periods of time.,Electronics
1400699894,I can now read books from my public library,Electronics
1400699894,Works like a charm. Light works great. Just the right size and very light weight. Just because it's a nook doesn't mean you're limited to purchasing from Barnes and Noble. A simple google search can help you with the process.,Electronics
1400699894,"Nook is great ;) It is much faster then the previous version, light is nice and very useful.<br />When using nook with light, battery keeps for around 2 weeks.",Electronics
